<?xml version="1.0" encoding="UTF-8"?>
<!DOCTYPE mconfig PUBLIC "-//NetBeans//DTD XTest cfg 1.0//EN" "http://www.netbeans.org/dtds/xtest-cfg-1_0.dtd">
<!--
The contents of this file are subject to the terms of the Common Development
and Distribution License (the License). You may not use this file except in
compliance with the License.

You can obtain a copy of the License at http://www.netbeans.org/cddl.html
or http://www.netbeans.org/cddl.txt.

When distributing Covered Code, include this CDDL Header Notice in each file
and include the License file at http://www.netbeans.org/cddl.txt.
If applicable, add the following below the CDDL Header, with the fields
enclosed by brackets [] replaced by your own identifying information:
"Portions Copyrighted [year] [name of copyright owner]"

The Original Software is NetBeans. The Initial Developer of the Original
Software is Sun Microsystems, Inc. Portions Copyright 1997-2006 Sun
Microsystems, Inc. All Rights Reserved.
-->

<!--
  These classes are excluded by default (defined in build.xml):
    "**/*Suite.class"
    "**/*$$*.class"
    "**/data/**"
    "**/hidden/**"
    "**/*Hidden.*"
    "**/*Hid.*"
-->

<mconfig name="java lexer unit test config">

    <testbag testattribs="stable" executor="code" name="testbag_1">
        <testset dir="unit/src">
            <patternset>
                <include name="**/**Test.class"/>
            </patternset>
        </testset>
    </testbag>
    
    <testbag testattribs="failing" executor="code" name="testbag_2">
        <testset dir="unit/src">
            <patternset>
            </patternset>
        </testset>
    </testbag>
    
    <!-- If you want to use this testbag you *must* provide xtest.includes property, -->
    <!-- (either on cmd line or in the script) to explicitly define which test       -->
    <!-- you want to run. This will run *only* tests from unit/src folder !!!        -->
    <testbag testattribs="empty" executor="code" name="testbag_empty">
        <testset dir="unit/src"/>
    </testbag>

    <executor name="code" antfile="../../../nbbuild/templates/xtest-unit.xml" target="run-unit-test"/>
    
    <compiler name="unit-compiler" antfile="../../../nbbuild/templates/xtest-unit.xml" target="default-compiler" default="true"/>
    
</mconfig>
